"Timestamp","I felt that I was easily able to grab the objects.
","I found it physically uncomfortable to manipulate the objects at times.","I found that I needed to release and re-grab the object in order to manipulate it in the way that I wanted.","It was easy to move objects to the location that I wanted. ","I found manipulating the objects to be frustrating. ","Do you have any other thoughts or comments that you would like to share?"
"2025/11/25 1:28:13 PM PST","4","1","1","4","1","It was interesting to try VR for the first time."
"2025/11/29 1:33:12 PM PST","5","1","4","5","1","First grab was difficult, after that it was easy. Once I figured it out it was easy."
"2025/11/29 5:24:47 PM PST","4","4","2","4","3","It was easy for me to move the objects but a bit difficult to adjust the position."
"2025/11/29 5:25:46 PM PST","5","1","5","5","1","i could only use one hand at a time"
"2025/12/02 4:43:15 PM PST","5","1","5","5","1","""It's perfect/too easy!"""
"2025/12/04 2:40:30 PM PST","5","1","1","5","1","I think this one was a lot better than the other one and went by faster and was funner."
