"Timestamp","I felt that I was easily able to grab the objects.","I found it physically uncomfortable to manipulate the objects at times.","I found that I needed to release and re-grab the object in order to manipulate it in the way that I wanted.","It was easy to move objects to the location that I wanted. ","I found manipulating the objects to be frustrating. ","Do you have any other thoughts or comments that you would like to share?"
"2025/11/25 1:35:37 PM PST","4","3","4","2","4","That one did feel a bit more difficult than the other one."
"2025/11/29 1:31:43 PM PST","5","4","4","2","5","I was not able to rotate the object, which was frustrating."
"2025/11/29 5:33:30 PM PST","4","3","2","4","3","grabbing the objects and moving them is easy but felt difficult to adjust the position."
"2025/11/29 5:37:21 PM PST","5","2","4","3","3","the block moves really slow"
"2025/12/02 4:37:34 PM PST","5","4","3","5","5","NO"
"2025/12/04 2:33:03 PM PST","5","1","4","5","4","Not really, I think it went well. "
